{
  "schema_version": "0.1",
  "learner_id": "lrn_0a1b2c3d4e5f6071",
  "recipient_id": "org_demo_recruiter",
  "role_ref": "role_junior_data_analyst",
  "competencies": ["cmp_data_analysis"],
  "scope": { "include": ["estimate_band", "method_labels", "understanding_status", "evidence_summary"] },
  "created_at": "2026-10-10T10:00:00Z",
  "expires_at": "2026-11-10T10:00:00Z",
  "revoked_at": null,
  "consent_text_version": "1.0"
}
